<?xml version="1.0" encoding="UTF-8"?>

<!ELEMENT root (row+)>
<!ELEMENT row (facultyName, departmentList+)>
<!ELEMENT facultyName (#PCDATA)>
<!ELEMENT departmentList (#PCDATA)>
<!ATTLIST row id ID #REQUIRED>
